{
  "schema": "dna-ai-premium-software-manifest",
  "version": "1.0",
  "releaseDate": "2026-09-03",
  "targetBaseline": "4.8-release-candidate-preview",
  "platform": {
    "os": [
      "Windows 10 x64",
      "Windows 11 x64"
    ],
    "python": [
      "3.11",
      "3.12",
      "3.13",
      "3.14"
    ],
    "offlineCore": true,
    "thirdPartyRuntimeDependencies": []
  },
  "application": [
    {
      "path": "install.bat",
      "bytes": 38,
      "sha256": "781e1ad636904858897a62c7859c3c0ec326965a7e8bb45b5f1ab529faa69c6e"
    },
    {
      "path": "izgradi-dna.bat",
      "bytes": 779,
      "sha256": "1032e3cb73bde5bc6e95e254ab86695842df862c4aec67c7fef6d01ceee71d78"
    },
    {
      "path": "pokreni.bat",
      "bytes": 376,
      "sha256": "9ce73651529ee9508b8fdd7968a33ad9db6f3aed06ca32c2351b4976a31a5937"
    },
    {
      "path": "premium_config.py",
      "bytes": 20407,
      "sha256": "2c1657aa5d0e0d498bc2655f6bdffaa351a3d86078c50cf3b86c64eead4d2098"
    },
    {
      "path": "project_model.py",
      "bytes": 3419,
      "sha256": "555bd90563ae4bac181af3993ac545adf9c0503ac07ceb75cdc630672499ccc6"
    },
    {
      "path": "recovery_release_check.py",
      "bytes": 10687,
      "sha256": "5a525190712a979fc63b8a74f76c2dae54ac72922f2c7f3f5cb3a633ab04163e"
    },
    {
      "path": "release_check.py",
      "bytes": 12919,
      "sha256": "0064292c9b664d62c16bcb753c06bcd72d84c3e1b4ed040d4469451b885389e1"
    },
    {
      "path": "release_packager.py",
      "bytes": 7409,
      "sha256": "16c48b36151003e9d99749a8e62f881b286c1ba4580a0631eb99f3e78b20ca13"
    },
    {
      "path": "run.bat",
      "bytes": 34,
      "sha256": "5aaf29243c21ed2286c56e6e81c4c35d7660b32e3ec0d944d9f2ccaa113347e5"
    },
    {
      "path": "server.py",
      "bytes": 92717,
      "sha256": "c5108a0c7298831e5fdf0ea278fc1b357d9a028f4f58a2087d185f91828dbaca"
    },
    {
      "path": "session10_release_check.py",
      "bytes": 3483,
      "sha256": "d7617a82d591e24a6e0412efe9672cbed908dfbc792a52ccb8b9a73b1965efbe"
    },
    {
      "path": "session11_release_check.py",
      "bytes": 3638,
      "sha256": "ddd0335a79d68064f1d307ee1e809ac7ad1442c226c6d490ddd86edaa130390d"
    },
    {
      "path": "session12_release_check.py",
      "bytes": 3571,
      "sha256": "71ebebca5458d0a1e70ed011097252b9c5743ea8b5515c4201f986f5d717e666"
    },
    {
      "path": "session13_release_check.py",
      "bytes": 6162,
      "sha256": "66921779d9c1be2dbc511dfcdd143ba1d2058375f7b9466ec618f6fec2c5f16d"
    },
    {
      "path": "session14_release_check.py",
      "bytes": 3271,
      "sha256": "e4e60234f881002f455af2b4d324cfd200775c6c7370798caf517bcdcd84cb93"
    },
    {
      "path": "session15_release_check.py",
      "bytes": 4615,
      "sha256": "bb13e503c9805e97bcb11058eb0c9238467b7b1262b0fd5538069e413b20a0d7"
    },
    {
      "path": "session17_release_check.py",
      "bytes": 11008,
      "sha256": "fab525e825a280a718fbb18453229c06104f2a27ba7d7d90914a02a69da0c797"
    },
    {
      "path": "session18_release_check.py",
      "bytes": 8453,
      "sha256": "3425a0b40d7db0f7a0ba73ac6abf549c59022f93dfeb030d60726d3bd28b19e0"
    },
    {
      "path": "session19_release_check.py",
      "bytes": 9829,
      "sha256": "7106f5554c8d67ebe37dfa63e7a097be1b95c88e4596e232d30f4583203a1efc"
    },
    {
      "path": "session20_release_check.py",
      "bytes": 9342,
      "sha256": "536adc0cb157b7f36fdbdf873478337b65125f3c53f4224b83e30f210c377571"
    },
    {
      "path": "session21_release_check.py",
      "bytes": 10478,
      "sha256": "5366d65fcfa0b2d1367f3a94c6903f0acb70e2fd61a4cc64aaecfd78730ce24c"
    },
    {
      "path": "session22_release_check.py",
      "bytes": 13634,
      "sha256": "b3a9df6af53cbf6d7957d839a6e657b10d35d8a1d58d0331d4a8bd4774b1d7f9"
    },
    {
      "path": "session23_release_check.py",
      "bytes": 13861,
      "sha256": "5852bbd5c0bc99800ffd77015e6d1e53dff604d8a775c594cfaae8bc849e2274"
    },
    {
      "path": "session24_release_check.py",
      "bytes": 9994,
      "sha256": "0a632e2ae43af760eaf14529856ce240408b4e8d35d66529fe19251ace394379"
    },
    {
      "path": "session25_release_check.py",
      "bytes": 10859,
      "sha256": "1b8a703c2663eae4f561752701afa302ea7926c2497c6a2341c2f99f4bb55bb4"
    },
    {
      "path": "session26_release_check.py",
      "bytes": 12287,
      "sha256": "afdd0beba15034caa31b23275e397fe8e22729d48505b541fcc01b9ac7d3f731"
    },
    {
      "path": "session27_release_check.py",
      "bytes": 11479,
      "sha256": "c70da0fe8d8e3b66b805e452821f31c65c6b67869579245a84db02405b68d0a9"
    },
    {
      "path": "session28_release_check.py",
      "bytes": 13740,
      "sha256": "74d77c69548fc479bfaf43f8dec52168f9e55cae9bb5b88bc688488b33ed8233"
    },
    {
      "path": "session29_release_check.py",
      "bytes": 14409,
      "sha256": "91bf0680ac514c3930e4e5b0d4cc9cb3f9fc9cd62c7a778099ae511eb20d79cc"
    },
    {
      "path": "session2_release_check.py",
      "bytes": 4118,
      "sha256": "2b86d33750e4be3b8fee215f6e0420fea5ed56583bc3308138227c000db5744d"
    },
    {
      "path": "session30_release_check.py",
      "bytes": 12069,
      "sha256": "76470eb377f15705c76e83d5338548e56e7261f2dc24ff41f1291d5f9e015fe4"
    },
    {
      "path": "session30_release_readiness.py",
      "bytes": 2342,
      "sha256": "774ec6012487eb7a0c12a18dd26afafff045ceecc4b3299a55599ca08539520b"
    },
    {
      "path": "session31_release_check.py",
      "bytes": 12559,
      "sha256": "79e808bc018f0875a4f558d2bc3d0a3b523bfb87a6cf672d3794ac610d17e387"
    },
    {
      "path": "session31b_release_check.py",
      "bytes": 11012,
      "sha256": "9d921d1f6ee4006757c82862a5c592e01e1bfe0b7b7ceaa9ee501ed12dcf588d"
    },
    {
      "path": "session32_release_check.py",
      "bytes": 10931,
      "sha256": "9cce0849714decee26aabb575a80d8a1ccbba3c4eaebdff543b71df3f16c46d8"
    },
    {
      "path": "session33_release_check.py",
      "bytes": 15616,
      "sha256": "6bba6ec60768a7f80f8fc8ca7090e5b90a2a25cbd717c848529b725e381f39cd"
    },
    {
      "path": "session34_release_check.py",
      "bytes": 1979,
      "sha256": "99d3e7db3d74d517702b7f102379634acd344d74d65923623e4a6a6e740a776b"
    },
    {
      "path": "session35_release_check.py",
      "bytes": 5301,
      "sha256": "da097de46e3d3ac7d7045cd8a450d5781af8436cd9e52b2311601af66b3d6d75"
    },
    {
      "path": "session36_release_check.py",
      "bytes": 8277,
      "sha256": "913ff139ccc90cfb2d702fe4789890bc684290bda92b392917937b0437f0d22c"
    },
    {
      "path": "session37_release_check.py",
      "bytes": 9091,
      "sha256": "d9adf206ebbadef4f27ca04e185ca0005f1c09d689c3eee505d6a0e3e5bd9cb7"
    },
    {
      "path": "session38_release_check.py",
      "bytes": 7972,
      "sha256": "75478467ff83dada8c05cd134819a00cb57e3ee3ac38328e7b8809cc00f491c4"
    },
    {
      "path": "session3_release_check.py",
      "bytes": 4698,
      "sha256": "293efcdf4d6755e6707b5b8b4f31d0b800268af32635aef4da04b2af34855ea0"
    },
    {
      "path": "session4_release_check.py",
      "bytes": 5107,
      "sha256": "86ecd9be2528c0c1bd73ff2ed5042426709bc5e7f850a9135b79fe8bbdb35971"
    },
    {
      "path": "session5_release_check.py",
      "bytes": 5643,
      "sha256": "14f8bd0c6ae35ecadf92295c42c77be6c67860ad82793d3db128b7f9a6f01173"
    },
    {
      "path": "session6_release_check.py",
      "bytes": 4066,
      "sha256": "fbf113a20cac6732ed3cc58fbc9a57b1dc46c864e9a3d8b91d3f69c54d91a29f"
    },
    {
      "path": "session7_release_check.py",
      "bytes": 3953,
      "sha256": "95695ff749de8ff60d5431345bc496e1a62fdefde1c2eb14ebb7f2cb0852f8d6"
    },
    {
      "path": "session8_release_check.py",
      "bytes": 5228,
      "sha256": "bfcc57588cb0846cf0cb155de0e6300e7041f0a53df45b72d7efa1a0c955ee5c"
    },
    {
      "path": "session9_release_check.py",
      "bytes": 3424,
      "sha256": "8963827401dbeaae91b3852a04d63ba272c06f936646dd56c9699779f9750d22"
    },
    {
      "path": "src/dna_midi_studio/__init__.py",
      "bytes": 26321,
      "sha256": "07ecfc79536689bc311a6255896de7e09fb1c48eeec677b18af3d974aa4c92d8"
    },
    {
      "path": "src/dna_midi_studio/agent_runtime.py",
      "bytes": 13854,
      "sha256": "e7e313e6cf283fc4457b00968986ff11872f0a689d25559aa3ea68e47a36b35f"
    },
    {
      "path": "src/dna_midi_studio/arrangement_graph.py",
      "bytes": 33272,
      "sha256": "82279f30c3a6cb54a0ad00e71923faa32f7d244544d31f9102955671b0097648"
    },
    {
      "path": "src/dna_midi_studio/arrangement_renderer.py",
      "bytes": 49737,
      "sha256": "f34ad7f96ad42896721d0f8c39c62d37df1b8580a8cce95b0f0525bdceef6223"
    },
    {
      "path": "src/dna_midi_studio/articulation_mapping.py",
      "bytes": 44722,
      "sha256": "dac275144750273d606a68d8d2d3be8f6215d1819923e5d2196700fe23eb42c1"
    },
    {
      "path": "src/dna_midi_studio/candidate_search.py",
      "bytes": 50619,
      "sha256": "6c97957f1e8861f470fbd94115150d1ae2ed1d77643a4187d033117ceb3fa29b"
    },
    {
      "path": "src/dna_midi_studio/device_certification.py",
      "bytes": 16661,
      "sha256": "336d8d12100176517a60502f3258047f32899fe1b2cddab81bad0a2850d8005f"
    },
    {
      "path": "src/dna_midi_studio/device_profile_certification.py",
      "bytes": 29062,
      "sha256": "63c6dbed16e611242d45a4e87f348c3703b77178c7da0133046ba033c1b78d57"
    },
    {
      "path": "src/dna_midi_studio/dnc_engine.py",
      "bytes": 27670,
      "sha256": "64b59a8258b4f121a1e2b3f9118b2af8c63de3783b5fc91d7c4a220af23be8f3"
    },
    {
      "path": "src/dna_midi_studio/drum_reconstruction.py",
      "bytes": 22133,
      "sha256": "92fc321b3bb8aea59971d82205d94992885086724a58134bbbb9f78fe9b2e261"
    },
    {
      "path": "src/dna_midi_studio/end_to_end_arranger.py",
      "bytes": 22826,
      "sha256": "d5778eb70d450c9e1deca2b5c3d20cc3f0836f544ed8705afcb78834d8aa081a"
    },
    {